slug	title	description	h1	p1	p2	p3	p4	cta1	cta2
chat-erotica-senza-registrazione	Chat erotica senza registrazione online	Chat erotica senza registrazione con accesso immediato a chat online attive e percorsi rapidi per utenti adulti.	Chat erotica senza registrazione	Accedere a una chat erotica senza registrazione permette di entrare subito senza creare account o completare passaggi inutili.	Le chat online senza registrazione sono spesso preferite da chi cerca accesso rapido, privacy e sessioni disponibili in pochi secondi.	Le aree attive possono cambiare rapidamente.	Quando trovi un accesso disponibile, conviene entrare subito.	Accedi ora	Vedi area privata
chat-erotica-gratis	Chat erotica gratis senza registrazione	Chat erotica gratis senza registrazione con accesso immediato a chat online attive per adulti.	Chat erotica gratis	Una chat erotica gratis senza registrazione consente di iniziare subito senza costi iniziali e senza creare un profilo.	Le chat online gratuite con accesso diretto sono ideali per chi vuole trovare sessioni attive in modo semplice e veloce.	La disponibilità può variare nel tempo.	Per questo è meglio entrare subito.	Entra ora	Apri area privata
live-chat-donne	Live chat donne online	Live chat donne online con accesso diretto a percorsi attivi e connessioni immediate per utenti adulti.	Live chat donne	Una live chat donne online offre accesso rapido a sessioni attive e a percorsi diretti senza attese inutili.	Le connessioni immediate rendono più semplice trovare live chat disponibili e ambienti attivi in tempo reale.	Alcune aree possono essere temporaneamente chiuse.	Se trovi una sessione attiva, entra subito.	Accedi live	Scopri di più
chat-erotica-anonima	Chat erotica anonima senza registrazione	Chat erotica anonima senza registrazione con accesso diretto a chat private e percorsi riservati per adulti.	Chat erotica anonima	Una chat erotica anonima permette di entrare rapidamente mantenendo maggiore riservatezza e senza procedure lunghe.	Il formato anonimo è spesso scelto da chi preferisce privacy, accesso immediato e chat online senza registrazione.	Le sessioni disponibili possono variare rapidamente.	Se trovi accesso attivo, entra subito.	Accedi ora	Vedi area privata
chat-incontri-italia	Chat incontri Italia online	Chat incontri Italia online con accesso diretto a percorsi rapidi e aree di chat attive per utenti adulti.	Chat incontri Italia	Una chat incontri Italia online consente di accedere velocemente a percorsi dedicati e a sessioni disponibili senza attese lunghe.	Le piattaforme di incontri con accesso diretto sono utili per chi cerca chat attive in Italia e collegamenti immediati.	La disponibilità può cambiare in qualsiasi momento.	Per questo conviene entrare senza aspettare.	Accedi ora	Scopri area privata
sexchat-senza-registrazione	Sexchat senza registrazione online	Sexchat senza registrazione con accesso immediato a chat online attive e percorsi rapidi per adulti.	Sexchat senza registrazione	Una sexchat senza registrazione permette di entrare subito in chat attive senza creare account o perdere tempo in passaggi extra.	L’accesso immediato alle chat online senza registrazione aumenta le possibilità di trovare sessioni disponibili in tempi rapidi.	Alcune aree possono essere temporaneamente chiuse.	Se trovi accesso disponibile, entra subito.	Entra ora	Vedi accesso privato
sexchat-immediata	Sexchat immediata online	Sexchat immediata online con accesso rapido a sessioni attive e percorsi diretti per utenti adulti.	Sexchat immediata	Una sexchat immediata online è pensata per chi vuole accedere subito a sessioni attive senza registrazioni lunghe o filtri inutili.	La rapidità di ingresso rende più facile trovare chat online disponibili e aree attive in pochi secondi.	Le sessioni attive possono aprirsi e chiudersi rapidamente.	Se l’accesso è disponibile, approfittane subito.	Accedi ora	Apri area privata
sexchat-live	Sexchat live online	Sexchat live online con accesso diretto a sessioni attive e percorsi immediati riservati a utenti adulti.	Sexchat live	Una sexchat live online offre accesso diretto a sessioni in tempo reale e a percorsi rapidi senza attese inutili.	Le sessioni live sono spesso preferite da chi cerca accesso immediato, attività in corso e chat online per adulti.	La disponibilità può essere limitata.	Se trovi una sessione attiva, entra ora.	Accedi live	Scopri di più